{
  "schema_version": 1,
  "updated_at": "2026-07-09",
  "status_role": "historical_snapshot",
  "current_use_forbidden": true,
  "live_status_command": "npm run review:release-readiness",
  "current_state_path": "vault/current-state.md",
  "scope": [
    "@github",
    "@openai-developers",
    "@codex-security",
    "@figma",
    "@canva"
  ],
  "overall_status": "not_release_ready",
  "current_pr": {
    "number": 6,
    "status": "selected_open_pr",
    "checks": "green_on_current_head",
    "source_of_truth": "Current npm run review:release-pr-candidates on 2026-07-09T02:44:57+08:00 ran gh pr list for base main, found one viable open non-draft mergeable PR, and selected configured release PR #6 at e874b686a73bfe07d57a29bf85eba0dc6702a699; docs/release_github_handoff_evidence.json remains diagnostic-only and stale for the current gh result.",
    "pr_candidate_review": {
      "command": "npm run review:release-pr-candidates",
      "result_file": "../release-evidence-temp/release-pr-candidates-current-result.json",
      "status": "passed",
      "gh_pr_list_checked_at": "2026-07-09T02:44:57+08:00",
      "gh_pr_list_open_pr_count": 1,
      "configured_release_pr_number": "6",
      "selected_release_pr_number": 6,
      "selected_release_pr_head_sha": "e874b686a73bfe07d57a29bf85eba0dc6702a699",
      "source_of_truth_for_current_pr_candidates": true,
      "connector_diagnostic": {
        "path": "docs/release_github_handoff_evidence.json",
        "checked_at": "2026-07-07T00:32:42+08:00",
        "current_gh_pr_list_checked_at": "2026-07-09T02:44:57+08:00",
        "is_stale_for_current_review": true,
        "does_not_close_release_readiness": true
      }
    },
    "connector_evidence": {
      "path": "docs/release_github_handoff_evidence.json",
      "tool": "mcp__codex_apps__github._get_users_recent_prs_in_repo",
      "state": "open",
      "result": "blocked",
      "pull_requests_count": 0,
      "checked_at": "2026-07-07T00:32:42+08:00",
      "does_not_close_release_readiness": true
    }
  },
  "release_readiness_check": {
    "command": "npm run review:release-readiness",
    "status": "failing_as_expected",
    "result_mode": "final",
    "final_release_ready": false,
    "default_evidence_dir": "../release-evidence-temp",
    "open_failures": [
      "controlled design handoff manifest not provided with real Figma, Canva, Brand Kit, design token, and flow coverage",
      "OTA credential rotation attestation not provided through controlled evidence or OTA_CREDENTIAL_ROTATION_ATTESTATION_FILE",
      "controlled release readiness still depends on the PR #6 head staying unchanged while design and OTA evidence are closed",
      "release-closing checkout is clean at PR #6 head e874b686a73bfe07d57a29bf85eba0dc6702a699 and must be rechecked after any PR update"
    ],
    "warnings": [
      "confirm GitHub Actions dependency audits on current PR head",
      "verify git status --short --branch before release"
    ],
    "result_file_template": "docs/release_readiness_result.example.json"
  },
  "blockers": [
    {
      "id": "production-env-missing",
      "scope": [
        "@openai-developers"
      ],
      "status": "closed",
      "title": "Production env evidence is present outside the repository",
      "evidence": "RELEASE_ENV_FILE=../release-evidence-temp/production.env passes npm run review:release-env without exposing env contents",
      "close_condition": "keep the controlled production env file outside the repository and rerun npm run review:release-env plus npm run review:release-readiness on the final release head"
    },
    {
      "id": "llm-connectivity-attestation-missing",
      "scope": [
        "@openai-developers"
      ],
      "status": "closed",
      "title": "Production LLM connectivity attestation is present",
      "evidence": "LLM_CONNECTIVITY_ATTESTATION_FILE=../release-evidence-temp/llm-attestation.json passes npm run review:release-llm; release-readiness with env and LLM evidence is saved outside the repo as release-readiness-env-llm-result.json",
      "close_condition": "keep the redacted attestation available outside the repository and rerun npm run review:release-llm plus npm run review:release-readiness on the final release head"
    },
    {
      "id": "design-handoff-missing",
      "scope": [
        "@figma",
        "@canva"
      ],
      "status": "open",
      "title": "Real Figma / Canva / design-token handoff is missing",
      "evidence": "no real controlled design handoff manifest is present under ../release-evidence-temp, DESIGN_HANDOFF_MANIFEST_FILE, or docs/design_handoff_manifest.json; 2026-07-07 read-only Figma and Canva connector checks were blocked by reauthentication requirements",
      "close_condition": "reauthenticate Figma and Canva connectors or provide independently controlled accessible source links, then provide Figma, Canva, Brand Kit, design_tokens_path, required flow coverage, non-future YYYY-MM-DD review date, empty open_issues, and pass npm run review:release-design"
    },
    {
      "id": "ota-credential-rotation-attestation-missing",
      "scope": [
        "@codex-security"
      ],
      "status": "open",
      "title": "OTA credential rotation attestation is missing",
      "evidence": "controlled OTA credential rotation attestation is missing under ../release-evidence-temp, OTA_CREDENTIAL_ROTATION_ATTESTATION_FILE, and docs/ota_credential_rotation_attestation.json",
      "close_condition": "provide a credential-free attestation covering Ctrip and Meituan platform rotation, backup cleanup, git tracking check, release-readiness rerun, reviewed_at inside the 30-day release evidence window, redaction_checked=true, and pass review:release-ota-credentials"
    },
    {
      "id": "codex-security-scan-missing",
      "scope": [
        "@codex-security"
      ],
      "status": "closed",
      "title": "Formal repo-wide Codex Security scan reports are present",
      "evidence": "docs/security/codex-security/latest contains scan_manifest.json, report.md, report.html, threat model, finding discovery report, coverage ledger, reviewed surfaces, validation summary, and attack-path analysis report; npm run review:release-security-scan passes",
      "close_condition": "keep docs/security/codex-security/latest or CODEX_SECURITY_SCAN_DIR available and rerun npm run review:release-security-scan on the final release head"
    },
    {
      "id": "local-git-state-open",
      "scope": [
        "@github"
      ],
      "status": "closed",
      "title": "PR handoff state is closed for the clean PR #6 verification worktree",
      "evidence": "Current review:release-pr-candidates selected configured release PR #6 at e874b686a73bfe07d57a29bf85eba0dc6702a699, review:release-staged-scope found no forbidden staged files, and review:release-external-state passed where local HEAD matches PR #6 and the worktree is clean.",
      "close_condition": "keep PR #6 open, non-draft, mergeable, green, and unchanged while design and OTA evidence are closed; rerun review:release-pr-candidates, review:release-staged-scope, review:release-external-state from a clean checkout whose local HEAD matches the final PR head, then rerun review:release-readiness"
    }
  ],
  "external_state_check": {
    "command": "npm run review:release-external-state",
    "status": "passing_from_clean_verification_worktree",
    "evidence_file_template": "docs/release_external_state_evidence.example.json",
    "result_file_template": "docs/release_external_state_result.example.json",
    "resolved": [
      "database/backups is not tracked by git",
      ".git/index.lock is absent",
      "local external-state evidence can be collected with npm run collect:release-external-state when Node child_process is blocked",
      "configured release PR #6 is open, non-draft, mergeable, green, and matches local HEAD in HOTEL-release-readiness-verify",
      "release external-state current result from the clean verification worktree has 11 passed, 1 warning, 0 failures"
    ],
    "open_failures": [],
    "warnings": [
      "rerun after every PR update because GitHub state changes outside the repository",
      "if Node child_process is unavailable, run npm run collect:release-external-state and set RELEASE_EXTERNAL_STATE_FILE to the captured JSON evidence"
    ]
  },
  "pr_candidate_check": {
    "command": "npm run review:release-pr-candidates",
    "status": "passing_not_release_closure",
    "result_file": "../release-evidence-temp/release-pr-candidates-current-result.json",
    "open_failures": [
      "configured release PR #6 selected from gh pr list checked_at=2026-07-09T02:01:24+08:00",
      "docs/release_github_handoff_evidence.json is stale non-closing diagnostic connector evidence and does not replace current gh pr list"
    ],
    "close_condition": "keep PR #6 selected with RELEASE_PR_NUMBER=6, rerun review:release-pr-candidates after every PR update, then run review:release-staged-scope and review:release-external-state from a checkout whose local HEAD matches that final PR head"
  },
  "staged_scope_check": {
    "command": "npm run review:release-staged-scope",
    "status": "passing_not_release_closure",
    "result_file": "../release-evidence-temp/release-staged-scope-current-result.json",
    "resolved": [
      "current Git index has no staged runtime/local files",
      "current Git index has no staged entries requiring explicit operator decision"
    ],
    "warnings": [
      "this does not prove the local worktree is clean",
      "this does not close the release external-state gate"
    ],
    "close_condition": "rerun on the final staged release PR bundle, keep runtime/local files out of the index, and let review:release-readiness consume the passing staged-scope result from outside the repository"
  },
  "plugin_status": [
    {
      "plugin": "@github",
      "status": "partial",
      "resolved": [